[
  {
    "barrier": "after guard check, before SQL commit",
    "boundary": "Authority commit",
    "id": "F-01",
    "injection": "SIGKILL real authority process",
    "oracle": "No partial semantic state/receipt/outbox",
    "spec_id": "SPEC-003"
  },
  {
    "barrier": "after commit, before client reply",
    "boundary": "Authority reply",
    "id": "F-02",
    "injection": "Drop connection; retry same and changed intent",
    "oracle": "Same receipt once; changed intent conflict; replay rights renewed",
    "spec_id": "SPEC-003"
  },
  {
    "barrier": "after approval, before new matching insert",
    "boundary": "Predicate read",
    "id": "F-03",
    "injection": "Race real serializable connections",
    "oracle": "Stale Case despite unchanged visible row versions",
    "spec_id": "SPEC-003"
  },
  {
    "barrier": "after object durable, before evidence commit",
    "boundary": "Capture admission",
    "id": "F-04",
    "injection": "Kill process; race cleanup",
    "oracle": "Orphan collectible only without pending/pin; no missing admitted bytes",
    "spec_id": "SPEC-004"
  },
  {
    "barrier": "after visible partial output, before settle",
    "boundary": "Turn settlement",
    "id": "F-05",
    "injection": "Kill/reclaim with old fence",
    "oracle": "At most one settled reply; no duplicate committed tool operation",
    "spec_id": "SPEC-009"
  },
  {
    "barrier": "after inbox/outbox commit, before ACK",
    "boundary": "Channel ingress",
    "id": "F-06",
    "injection": "Provider redelivery and process restart",
    "oracle": "One admitted inbound message; valid retry safe",
    "spec_id": "SPEC-011"
  },
  {
    "barrier": "after arbitration, before composition",
    "boundary": "Delayed notice",
    "id": "F-07",
    "injection": "Revoke source/member permission",
    "oracle": "Suppress/redact with freshly authorized view",
    "spec_id": "SPEC-020"
  },
  {
    "barrier": "after preparation, before head lock",
    "boundary": "Release activation",
    "id": "F-08",
    "injection": "Concurrent evidence and policy change",
    "oracle": "PreparationStale; no mixed generation",
    "spec_id": "SPEC-014"
  },
  {
    "barrier": "provider accepts, reply lost",
    "boundary": "External effect",
    "id": "F-09",
    "injection": "Timeout then repeated durable job",
    "oracle": "Unknown preserved; no blind unsafe resend",
    "spec_id": "SPEC-023"
  },
  {
    "barrier": "cancel requested while provider accepts",
    "boundary": "Cancellation",
    "id": "F-10",
    "injection": "Reorder acceptance/cancel callbacks",
    "oracle": "Local stop separate from escaped outcome",
    "spec_id": "SPEC-023"
  },
  {
    "barrier": "two reservation requests concurrently",
    "boundary": "Budget children",
    "id": "F-11",
    "injection": "Real SQL race, 70+70 against100",
    "oracle": "At most one 70 accepted; total ≤100",
    "spec_id": "SPEC-024"
  },
  {
    "barrier": "before secret/network/output access",
    "boundary": "Runner boundary",
    "id": "F-12",
    "injection": "Actual guest host/metadata/egress probe",
    "oracle": "Denied by infrastructure/broker, not merely guest convention",
    "spec_id": "SPEC-030"
  },
  {
    "barrier": "after pin before PG publication",
    "boundary": "Snapshot publication",
    "id": "F-13",
    "injection": "Catalog GC and process kill",
    "oracle": "No published missing snapshot; no mixed version set",
    "spec_id": "SPEC-031"
  },
  {
    "barrier": "after checkpoint, before source gap recovery",
    "boundary": "Stream coverage",
    "id": "F-14",
    "injection": "Duplicate/out-of-order/missing events",
    "oracle": "Coverage gap explicit; no destructive inferred empty state",
    "spec_id": "SPEC-032"
  },
  {
    "barrier": "between displayed and approved price",
    "boundary": "Live observation",
    "id": "F-15",
    "injection": "Feed changes and entitlement expires",
    "oracle": "Exact capture or stale/denied; no latest-value substitution",
    "spec_id": "SPEC-033"
  },
  {
    "barrier": "old backup includes erased artifact",
    "boundary": "Erase and restore",
    "id": "F-16",
    "injection": "Restore full cell in isolated environment",
    "oracle": "Suppression ledger applied before any disclosure or effects",
    "spec_id": "SPEC-039"
  },
  {
    "barrier": "directory CAS while source unreachable",
    "boundary": "Cell migration",
    "id": "F-17",
    "injection": "Partition without independent source fence",
    "oracle": "No new writable primary",
    "spec_id": "SPEC-042"
  },
  {
    "barrier": "one local commit, other rejects",
    "boundary": "Federated action",
    "id": "F-18",
    "injection": "Partial remote failure",
    "oracle": "Independent receipts, explicit partial compensation options",
    "spec_id": "SPEC-043"
  },
  {
    "barrier": "after lease expiry before sync",
    "boundary": "Offline lease",
    "id": "F-19",
    "injection": "Reconnect stale edge and replay actions",
    "oracle": "No revived authority; pending local claims reviewed normally",
    "spec_id": "SPEC-044"
  },
  {
    "barrier": "fill/bust/cancel/allocation callbacks",
    "boundary": "Financial lifecycle",
    "id": "F-20",
    "injection": "Duplicate and permute verified broker events",
    "oracle": "Quantity conservation, no inferred custody settlement",
    "spec_id": "SPEC-047"
  },
  {
    "barrier": "before ranking/context generation",
    "boundary": "Hidden evidence",
    "id": "F-21",
    "injection": "Paired World differs only in forbidden rival",
    "oracle": "Equivalent permitted content/counts/confidence/errors",
    "spec_id": "SPEC-025"
  },
  {
    "barrier": "permission revocation between polls",
    "boundary": "Source ACL",
    "id": "F-22",
    "injection": "Expired entitlement without complete delta",
    "oracle": "Fail-closed coverage and no stale disclosure",
    "spec_id": "SPEC-041"
  },
  {
    "barrier": "after wrong scoped reply then undo",
    "boundary": "Human correction",
    "id": "F-23",
    "injection": "Replay prior question and correction IDs",
    "oracle": "History preserved, no global rule installation",
    "spec_id": "SPEC-017"
  },
  {
    "barrier": "after signed build, changed dependency",
    "boundary": "Supply-chain promotion",
    "id": "F-24",
    "injection": "Tamper image/manifest or current lock",
    "oracle": "Admission denies mismatched provenance",
    "spec_id": "SPEC-029"
  },
  {
    "barrier": "before POST redemption",
    "boundary": "Link challenge",
    "id": "F-25",
    "injection": "Race copied browser proofs and preview fetches",
    "oracle": "Only bound authenticated POST may consume once; previews never consume",
    "spec_id": "SPEC-051"
  },
  {
    "barrier": "before final authorization/send",
    "boundary": "App disclosure",
    "id": "F-26",
    "injection": "Commit revocation and fail auth store",
    "oracle": "No new authorized data dispatch; explicit deny/unavailable",
    "spec_id": "SPEC-051"
  },
  {
    "barrier": "after iframe navigation",
    "boundary": "Bridge identity",
    "id": "F-27",
    "injection": "Replay old source window/channel messages",
    "oracle": "No dispatch under replacement session",
    "spec_id": "SPEC-053"
  },
  {
    "barrier": "before warm instance reuse",
    "boundary": "Guest state",
    "id": "F-28",
    "injection": "Alternate owner/worker and restore snapshot",
    "oracle": "No cross-subject/purpose private state or stale grant",
    "spec_id": "SPEC-053"
  },
  {
    "barrier": "after generation before download",
    "boundary": "App export",
    "id": "F-29",
    "injection": "Revoke source rights",
    "oracle": "Download denied; handle cannot authorize",
    "spec_id": "SPEC-050"
  },
  {
    "barrier": "after internal deploy before proof write",
    "boundary": "Runtime staging",
    "id": "F-30",
    "injection": "Kill runtime host",
    "oracle": "Reconcile immutable slot; public binding unchanged",
    "spec_id": "SPEC-054"
  },
  {
    "barrier": "after prepare before activation",
    "boundary": "Runtime publication",
    "id": "F-31",
    "injection": "Revoke author or advance release head",
    "oracle": "Denied/PreparationStale; no public promotion",
    "spec_id": "SPEC-054"
  },
  {
    "barrier": "after recall before routing cache invalidation",
    "boundary": "Runtime recall",
    "id": "F-32",
    "injection": "Send request to stale host",
    "oracle": "Current recall blocks data/calls; no latest fallback",
    "spec_id": "SPEC-054"
  },
  {
    "barrier": "before authority commit",
    "boundary": "App action",
    "id": "F-33",
    "injection": "Insert predicate match and replay same ID across surfaces",
    "oracle": "Stale or one prior result as applicable; no duplicate effect",
    "spec_id": "SPEC-055"
  },
  {
    "barrier": "before supplying protected Frame",
    "boundary": "Guest disclosure",
    "id": "F-34",
    "injection": "Remove executable disclosure admission",
    "oracle": "No protected guest payload; trusted renderer/fail-closed",
    "spec_id": "SPEC-053"
  },
  {
    "barrier": "during resource/tool negotiation",
    "boundary": "MCP host",
    "id": "F-35",
    "injection": "Host omits required security capability",
    "oracle": "Text/protected-link fallback without authority leak",
    "spec_id": "SPEC-053"
  },
  {
    "barrier": "during bounded batch/fanout",
    "boundary": "App load",
    "id": "F-36",
    "injection": "Saturate workload, buffer and cancel",
    "oracle": "Explicit quota/gaps, bounded memory and no raw-source bypass",
    "spec_id": "SPEC-055"
  }
]
